{
  "adapter_id": "local.design-artifact",
  "adapter_sha256": "0f813028b2e27aece86a1143cbe361a5332f3553983c4cea80fb457b8d974881",
  "generator_version": "3.2.0",
  "records": [
    {
      "actual": "all deterministic local checks passed",
      "artifacts": [
        {
          "path": "COMPONENTS.md",
          "sha256": "7c119fc76c9b22e1c5063426de89d064294dcef25abb3440e4397aedc74a31e3"
        },
        {
          "path": "COMPONENT_API.md",
          "sha256": "95d76f72ae0b853b56cc3c62398e1d5588869652ee15313b5f958d0bfaff920f"
        },
        {
          "path": "07-components/components.json",
          "sha256": "fb87291f4985b7cd081f600704689da94ee9826f3d908648bcd9292f33321a72"
        }
      ],
      "created_at": "2026-08-25T15:22:48.010687+00:00",
      "environment": {
        "generator_version": "3.2.0",
        "network": "none"
      },
      "evidence_class": "trusted_verifier",
      "expected": "all supplied artifacts are substantive and contain required design-contract markers",
      "fixture": "habitat-journey-production-artifacts",
      "id": "local-design-domain_neutrality_validation-001",
      "requirement_id": "domain_neutrality_validation",
      "status": "pass",
      "test": "artifact integrity, parseability, prohibited placeholders, and requirement markers",
      "verifier_id": "local.design-artifact"
    },
    {
      "actual": "all deterministic local checks passed",
      "artifacts": [
        {
          "path": "COMPONENTS.md",
          "sha256": "7c119fc76c9b22e1c5063426de89d064294dcef25abb3440e4397aedc74a31e3"
        },
        {
          "path": "COMPONENT_API.md",
          "sha256": "95d76f72ae0b853b56cc3c62398e1d5588869652ee15313b5f958d0bfaff920f"
        },
        {
          "path": "07-components/components.json",
          "sha256": "fb87291f4985b7cd081f600704689da94ee9826f3d908648bcd9292f33321a72"
        }
      ],
      "created_at": "2026-08-25T15:22:48.010687+00:00",
      "environment": {
        "generator_version": "3.2.0",
        "network": "none"
      },
      "evidence_class": "trusted_verifier",
      "expected": "all supplied artifacts are substantive and contain required design-contract markers",
      "fixture": "habitat-journey-production-artifacts",
      "id": "local-design-common_app_coverage_validation-002",
      "requirement_id": "common_app_coverage_validation",
      "status": "pass",
      "test": "artifact integrity, parseability, prohibited placeholders, and requirement markers",
      "verifier_id": "local.design-artifact"
    },
    {
      "actual": "all deterministic local checks passed",
      "artifacts": [
        {
          "path": "COMPONENTS.md",
          "sha256": "7c119fc76c9b22e1c5063426de89d064294dcef25abb3440e4397aedc74a31e3"
        },
        {
          "path": "COMPONENT_API.md",
          "sha256": "95d76f72ae0b853b56cc3c62398e1d5588869652ee15313b5f958d0bfaff920f"
        },
        {
          "path": "07-components/components.json",
          "sha256": "fb87291f4985b7cd081f600704689da94ee9826f3d908648bcd9292f33321a72"
        }
      ],
      "created_at": "2026-08-25T15:22:48.010687+00:00",
      "environment": {
        "generator_version": "3.2.0",
        "network": "none"
      },
      "evidence_class": "trusted_verifier",
      "expected": "all supplied artifacts are substantive and contain required design-contract markers",
      "fixture": "habitat-journey-production-artifacts",
      "id": "local-design-component_api_quality_validation-003",
      "requirement_id": "component_api_quality_validation",
      "status": "pass",
      "test": "artifact integrity, parseability, prohibited placeholders, and requirement markers",
      "verifier_id": "local.design-artifact"
    }
  ]
}
