{
  "adapter_id": "local.design-artifact",
  "adapter_sha256": "0f813028b2e27aece86a1143cbe361a5332f3553983c4cea80fb457b8d974881",
  "generator_version": "3.2.0",
  "records": [
    {
      "actual": "all deterministic local checks passed",
      "artifacts": [
        {
          "path": "06-tokens/tokens.json",
          "sha256": "6f40d1cc99f0221083a61be418d78949b6c58da5d75ddcea6eb29b428ba4815b"
        },
        {
          "path": "TOKEN_GOVERNANCE.md",
          "sha256": "ed479fe2db328bf2bd94817956d0e5baf02c34f006cec839bf6cae213c522489"
        }
      ],
      "created_at": "2026-08-25T15:21:45.360183+00:00",
      "environment": {
        "generator_version": "3.2.0",
        "network": "none"
      },
      "evidence_class": "trusted_verifier",
      "expected": "all supplied artifacts are substantive and contain required design-contract markers",
      "fixture": "habitat-journey-production-artifacts",
      "id": "local-design-token_governance_validation-001",
      "requirement_id": "token_governance_validation",
      "status": "pass",
      "test": "artifact integrity, parseability, prohibited placeholders, and requirement markers",
      "verifier_id": "local.design-artifact"
    }
  ]
}
